{
  "status_geral": "REPROVADO",
  "pontuacao": {
    "cobertura": 6,
    "fidelidade_ao_requisito": 8,
    "clareza": 7,
    "automatizabilidade": 9
  },
  "casos_aprovados": [
    "TC-04-01",
    "TC-04-02"
  ],
  "casos_reprovados": [
    "TC-04-03",
    "TC-04-06"
  ],
  "problemas": [
    {
      "caso_de_teste": "TC-04-03",
      "tipo": "omissao",
      "descricao": "Filtro não retorna nenhum item",
      "evidencia_na_historia": "CA-04.3: Quando o filtro não retorna nenhum item, a resposta é 200 com items=[] e total=0.",
      "acao_recomendada": "Incluir cenário para quando o filtro não retorna nenhum item"
    },
    {
      "caso_de_teste": "TC-04-06",
      "tipo": "omissao",
      "descricao": "Cenário para quando o filtro não retorna nenhum item",
      "evidencia_na_historia": "CA-04.3: Quando o filtro não retorna nenhum item, a resposta é 200 com items=[] e total=0.",
      "acao_recomendada": "Incluir cenário para quando o filtro não retorna nenhum item"
    }
  ],
  "cenarios_omitidos_sugeridos": [
    {
      "descricao": "Cenário para quando o filtro não retorna nenhum item",
      "criterio_relacionado": "CA-04.3",
      "justificativa": "Para garantir que a resposta seja 200 com items=[] e total=0, mesmo quando o filtro não retorna nenhum item.",
      "tipo_sugerido": "borda"
    }
  ],
  "decisao": "REPROVADO"
}
