{
  "status_geral": "REPROVADO",
  "pontuacao": {
    "cobertura": 5,
    "fidelidade_ao_requisito": 6,
    "clareza": 7,
    "automatizabilidade": 8
  },
  "casos_aprovados": [
    "TC-05-01",
    "TC-05-02"
  ],
  "casos_reprovados": [
    "TC-05-03",
    "TC-05-04",
    "TC-05-05",
    "TC-05-06"
  ],
  "problemas": [
    {
      "caso_de_teste": "TC-05-03",
      "tipo": "omissao",
      "descricao": "O cenário de cancelamento de solicitação própria em status 'cancelada' não está presente na história.",
      "evidencia_na_historia": "Nenhuma menção ao cancelamento de solicitações canceladas é feita na história.",
      "acao_recomendada": "Incluir o cenário de cancelamento de solicitação própria em status 'cancelada' na história."
    },
    {
      "caso_de_teste": "TC-05-04",
      "tipo": "omissao",
      "descricao": "O cenário de cancelamento de solicitação própria em status 'finalizada' não está presente na história.",
      "evidencia_na_historia": "Nenhuma menção ao cancelamento de solicitações finalizadas é feita na história.",
      "acao_recomendada": "Incluir o cenário de cancelamento de solicitação própria em status 'finalizada' na história."
    },
    {
      "caso_de_teste": "TC-05-05",
      "tipo": "fato_incorreto",
      "descricao": "O caso assume que o usuário autenticado pode cancelar uma solicitação de outro usuário.",
      "evidencia_na_historia": "A história não menciona a permissão do usuário para cancelar solicitações de outros usuários.",
      "acao_recomendada": "Revisar a história para incluir a permissão do usuário para cancelar solicitações de outros usuários."
    },
    {
      "caso_de_teste": "TC-05-06",
      "tipo": "fato_incorreto",
      "descricao": "O caso assume que o usuário autenticado pode cancelar uma solicitação inexistente.",
      "evidencia_na_historia": "A história não menciona a possibilidade de cancelamento de solicitações inexistentes.",
      "acao_recomendada": "Revisar a história para incluir o cancelamento de solicitações inexistentes."
    }
  ],
  "cenarios_omitidos_sugeridos": [
    {
      "descricao": "Cancelar solicitação própria em status 'cancelada'",
      "criterio_relacionado": "CA-05.3",
      "justificativa": "Essa é uma situação comum que pode ocorrer em sistemas de gerenciamento de solicitações.",
      "tipo_sugerido": "borda"
    },
    {
      "descricao": "Cancelar solicitação própria em status 'finalizada'",
      "criterio_relacionado": "CA-05.3",
      "justificativa": "Essa é uma situação comum que pode ocorrer em sistemas de gerenciamento de solicitações.",
      "tipo_sugerido": "borda"
    }
  ],
  "decisao": "REPROVADO"
}
