{
  "status_geral": "REPROVADO",
  "pontuacao": {
    "cobertura": 8,
    "fidelidade_ao_requisito": 10,
    "clareza": 10,
    "automatizabilidade": 10
  },
  "casos_aprovados": [
    "TC-01-01",
    "TC-01-02",
    "TC-01-03",
    "TC-01-04",
    "TC-01-05",
    "TC-01-06"
  ],
  "casos_reprovados": [],
  "problemas": [],
  "cenarios_omitidos_sugeridos": [
    {
      "descricao": "Verificar que um login bem-sucedido reseta o contador de tentativas falhas consecutivas.",
      "criterio_relacionado": "CA-01.3",
      "justificativa": "O critério CA-01.3 afirma explicitamente que 'Login bem-sucedido reseta o contador'. Embora TC-01-01 cubra o login bem-sucedido, ele não inclui a verificação do reset do contador de tentativas falhas. Um cenário dedicado seria necessário para simular tentativas falhas, seguidas de um login bem-sucedido, e então novas tentativas falhas para confirmar que o contador foi zerado.",
      "tipo_sugerido": "borda"
    }
  ],
  "decisao": "REPROVADO"
}
