{
  "status_geral": "REPROVADO",
  "pontuacao": {
    "cobertura": 8,
    "fidelidade_ao_requisito": 10,
    "clareza": 10,
    "automatizabilidade": 10
  },
  "casos_aprovados": [
    "TC-01-01",
    "TC-01-02",
    "TC-01-03",
    "TC-01-04",
    "TC-01-05",
    "TC-01-06"
  ],
  "casos_reprovados": [],
  "problemas": [],
  "cenarios_omitidos_sugeridos": [
    {
      "descricao": "Verificar que um login bem-sucedido reseta o contador de tentativas falhas.",
      "criterio_relacionado": "CA-01.3",
      "justificativa": "O critério CA-01.3 explicitamente afirma 'Login bem-sucedido reseta o contador.' Este cenário é crucial para garantir que a política de bloqueio funcione conforme o esperado e que o usuário possa fazer login após tentativas falhas, desde que a senha correta seja fornecida antes do bloqueio ou após o desbloqueio.",
      "tipo_sugerido": "borda"
    },
    {
      "descricao": "Verificar que a conta é automaticamente desbloqueada após o período de 60 segundos.",
      "criterio_relacionado": "CA-01.3",
      "justificativa": "O critério CA-01.3 especifica que 'a conta é bloqueada por 60 segundos'. É fundamental verificar que, após esse período, a conta retorna ao estado desbloqueado e o login com credenciais corretas é novamente possível. Isso garante que o bloqueio não seja permanente ou de duração incorreta.",
      "tipo_sugerido": "borda"
    }
  ],
  "decisao": "REPROVADO"
}
