{
  "status_geral": "REPROVADO",
  "pontuacao": {
    "cobertura": 5,
    "fidelidade_ao_requisito": 6,
    "clareza": 7,
    "automatizabilidade": 8
  },
  "casos_aprovados": [],
  "casos_reprovados": [
    "TC-01-04",
    "TC-01-05"
  ],
  "problemas": [
    {
      "caso_de_teste": "TC-01-04",
      "tipo": "fato_incorreto",
      "descricao": "O caso assume que a mensagem de erro é 'E-mail ou senha inválidos.' quando na verdade deve ser apenas 'E-mail ou senha inválidos'.",
      "evidencia_na_historia": "Critério CA-01.2: Com e-mail inexistente ou senha incorreta, o login retorna 401 com a mensagem genérica \"E-mail ou senha inválidos.\" — a mesma mensagem para os dois casos, sem revelar se o e-mail existe.",
      "acao_recomendada": "Corrigir a mensagem de erro no caso de teste."
    },
    {
      "caso_de_teste": "TC-01-05",
      "tipo": "omissao",
      "descricao": "O cenário não cobre o caso em que o usuário tenta realizar login com um e-mail bloqueado por lockout.",
      "evidencia_na_historia": "Critério CA-01.3: Após 5 tentativas falhas consecutivas no mesmo e-mail, a conta é bloqueada por 60 segundos. Durante o bloqueio, qualquer tentativa (incluindo senha correta) retorna 423 Locked com header Retry-After.",
      "acao_recomendada": "Adicionar um novo cenário que cobre esse caso."
    }
  ],
  "cenarios_omitidos_sugeridos": [
    {
      "descricao": "Cenário em que o usuário tenta realizar login com um e-mail bloqueado por lockout.",
      "criterio_relacionado": "CA-01.3",
      "justificativa": "Essa é uma situação importante para testar a funcionalidade de bloqueio de contas.",
      "tipo_sugerido": "negativo"
    }
  ],
  "decisao": "REPROVADO"
}
