{
  "status_geral": "REPROVADO",
  "pontuacao": {
    "cobertura": 6,
    "fidelidade_ao_requisito": 8,
    "clareza": 7,
    "automatizabilidade": 9
  },
  "casos_aprovados": [],
  "casos_reprovados": [
    "TC-01-04",
    "TC-01-05"
  ],
  "problemas": [
    {
      "caso_de_teste": "TC-01-04",
      "tipo": "fato_incorreto",
      "descricao": "O caso assume que a mensagem de erro é 'E-mail inválido.' quando na verdade deve ser 'E-mail ou senha inválidos.'.",
      "evidencia_na_historia": "Critério CA-01.4: \"Tentar realizar login com um e-mail em formato inválido (ex: 'email_sem_arroba') retorna 422 Unprocessable Entity e o login não é efetuado.\"",
      "acao_recomendada": "Corrigir a mensagem de erro para refletir a história correta."
    },
    {
      "caso_de_teste": "TC-01-05",
      "tipo": "omissao",
      "descricao": "O cenário não cobre o caso em que o usuário tenta realizar login com um e-mail bloqueado por lockout.",
      "evidencia_na_historia": "Critério CA-01.3: \"Após 5 tentativas falhas consecutivas no mesmo e-mail, a conta é bloqueada por 60 segundos.\"",
      "acao_recomendada": "Adicionar cenário que cobre o caso de login com um e-mail bloqueado."
    }
  ],
  "cenarios_omitidos_sugeridos": [
    {
      "descricao": "Cenário em que o usuário tenta realizar login com um e-mail bloqueado por lockout.",
      "criterio_relacionado": "CA-01.3",
      "justificativa": "Essa é uma situação importante a ser testada, pois pode afetar a experiência do usuário.",
      "tipo_sugerido": "negativo"
    }
  ],
  "decisao": "REPROVADO"
}
